numéro,auteur,Pays revue,revue,date,album,titre,texte
17,Henry Edwards,New York,New York Times,08/12/73,Aladdin Sane,Pop; Who (or What) Is David Bowie?,"DAVID BOWIE'S best known lyrics are knotty, surrealistic “scifi” cryptograms that conjure up people with “space faces” and “electric eyes.” These dehumanized creatures swallow “protein pills,” daydream “moonage daydreams,” endure names like “Ziggy Stardust,” and are en intrinsic part of a songbook that could pass for a rock musical version of Stanley Kubrick's “2001.”If Kubrick's cimema epic of a seared tomorrow has influenced Bowie in his role as composer, the futuristic look of Kubrick's “A Clockwork Orange” has tellingly influenced the unorthodox physical appearance that Bowie brings to his stage act. The composer's hair is dyed a startling reddish‐orange; his costumes are the very definition of overwrought uni‐sex fashion; his soft features are highlighted by generous amounts of delicately hued lipstick, rouge and eye shadow. Bowie not only has an epicene air about him but also looks as if he had been plated with a chromium alloy.The photograph of the rock superstar on the album jacket of his latest release, Aladdin Sane (RCA LSP‐4852), is the most cunning representation to date of this angel‐faced, 25‐year‐old, English composer‐performer as a disembodied spirit of the Space Age.Bowie has been given a luminous new rouging and shellacking, and his tinted hair has been given the obligatory glinting touch‐up. In addition—as if anyone could possible miss the point—an unearthly streak of blue, black and red‐colored lightning has been splashed across the right side of his face. One look at the gleaming flash on Bowie's pan and one inevitably suspects “Aladdin Sane” to be another rehash of intergalactic mafianas.One is in for a surprise. The David Bowie of the “Aladdin Sane” record jacket is not the David Bowie of “Aladdin Sane.” Bowie has always been a lilting melodist, a quirky and not uninteresting lyricist and an expert arranger and studio producer. While these skLls have always manifested themselves on his five prior disks, Bowie's oh. so au courant songs have always proved an effective disguise for the song writer's wellspring of morbidity. In “Aladdin Sane” Bowie allows that morbidity to gush forth without inhibition and, in the process, he has created the most expressive, if still uneven, album of his recording career.Continue reading the main storyThe selling of Bowie, however, has been such an efficient example of the popular culture power plant in fullscale operation that one can't help wondering if this disk's ripened contents, as well as its jacket, aren't more computerized gimmicks whose function is to tantalize anew Bowie's easily manipulated horde of fans.The contents of a conversation with Bowie a little more than a year ago indicate that the composer may deserve the benefit of this particular doubt. Bowie put aside his ultra‐modernism for the moment and admitted that his thinking had been greatly influenced by—of all things—his reading of two novels. The English superstar confessed that he had formed a desperate identification with Hubert Selby, Jr.'s “Last Exit to Brooklyn,” that lacerating vision of an urban hell named New York City. He also related that he had dropped out of school at age ‘12 to pursue a show business career after reading “On the Road,” Jack Kerouac's late1950's cult‐invoking odyssey of restless, alienated “Hipsterdom” tearing across the country in a futile search for kicks for revelationIt appears that the composer‐performer has given both of these contemporary American novels a careful reading. Six of “Aladdin Sane's” 10 selections are annotated with the names of cities Bowie visited during his first tour of the United States, a one‐month excursion during the fall of 1972 which took Howie to 15 different destinetops. Using this tour as source material, Bowie, inspired by Selby's raging point Of view, crash‐landed his Hying‐saucer‐to‐the‐future into the heartlands of contemporary America and then borrowed Kerouac's free‐form literary style to create an “On the Road” of his own.Expect no other pop or rock album this year to so. ferociously envision this country as a devitalized landscape whose only signposts are violence, cruelty, turpitude, disillusionment, sexual frustration and drug and alcohol abuse. Expect no other pop or rock album this year to mate its festering contents to a series of musical effects totally dedicated to unhinging an already dislocated listener.A desolate portrait of revolution in the streets, “Panic in Detroit,” for example, has been arranged to include a back‐up vocal trio which delivers a series of insistent, unnerving, terror‐stricken, yelping vocal stings that diabolically suggest a pack of maddened dogs roaming through the streets of a firebombed city. In addition, during the disk's title selection, keyboardist Mike Garson also torments the listener by banging out a series of dissonant tone clusters that are borrowed freely from such disparate sources as George Gershwin, Jelly Roll Morton, Carmen Caballero, Art Tatum and Liberace. These clusters eventually evolve into a long, eerie, ephemeral instrumental bridge that is a perfectly controlled musical etching of the delirium of “Aladdin sanes insane ladThe malevolent “Drive In Saturday” utilizes the heavy, danceable, simple melody line of one of those mindless, ly joyful late‐1950's/early1960's rock ‘n’ roll “golden oldies.” Bowie ironically has pitted this bouncy music against a blistering series of unpleasant images which include a venomous delineation of two loveless lovers who came of age in the late 1960's and who desperately invoke the name of Mick Jagger, one of their gods of the past, in a pathetic attempt to rekindle their lost sexual passion. To further prove that Jagger is no more than an emasculated relic from days gone by, the composer‐performer delivers a mannered, somewhat parodistic, sexually ambiguous verson of the Jagger‐Keith Richard “Let's Spend the Night Together,” a huge hit for the Rolling Stones in 1967When the Stones appeared on the Ed Sullivan Show shortly after the release of this record, Sullivan forced them to launder the tune's lyrics for family consumption. Six years later, this bald sexual,proposition, plunked down in the midst of Bowie's diary of dementia, looms as a statement of complete mental health.For all of the icy professionalism that Bowie has lavished on this fascinating recording, the disk does seem incapable of eliciting true emotional response from the listener. In “Time,” the album's most crucial cut, the composer steps into the spotlight usually reserved for Lotte Lenya, trots out the Sprechstimme, and belts a hymn to the feckless ways with which people deal with the relentless march of time. But “Time” is no theater song by Bert Brecht and Kurt Weill, if only because Brecht did highlight more significant details when dealing with the foibles of mankind than the trendish abuse of methaqualones.One is not touched by “Time” because of its pretentions; but one is also left untouched by all the rest of Bowie's dazzlingly arranged, produced, and performed parade of decadence. The composer‐performer may not be treating decadence as an exploitive gimmick but neither is he illuminating it.To his reading Hitoratemporay American novels, Bowie should add William Burroughs's “Naked Lunch.” Placed beside Burroughs's unrelieved narrative of terror and depravity, the contents of “Aladdin Sane” shrink to the size of a pimple. Thoroughly committed to his belief that the modern world is hell, Burroughs is also outraged by this belief. This outrage permeates his work enabling the reader to feel something, if only disgust. There is no similar passion running through “Aladdin Sane” and, therefore, one feels nothing.Bowie has finally settled down to do serious work, He has proved that he has more than enough talent for the task. It's time he got out the cold cream, cleaned his face, and began to mine his feelings and experiences in order to dredge up the passions that will enable him to avoid any more repetitions of the shallowness that mars the corrosive, angry “Aladdin Sane.”"
18,Martin Kirkup,Los Angeles,Rock,05/04/74,Diamond Dogs,Diamond David,"    ""And in the death as the last few rotting corpses lay… ten thousand peoploids split into smaller tribes coveting the highest of the sterile skyscrapers… like packs of dogs assaulting the glass fronts of Love Me Avenue. Any day now — the year of the Diamond Dogs. This ain't Rock 'n' Roll — this is genocide.""That's the vision that opens David Bowie's eighth album, Diamond Dogs, due to hit the streets late in May. By the time you've heard those words, you'll already have had to cope with the cover-art depiction of Bowie metamorphosed into a dog — a nightmare disturbingly detailed by Guy Peellaert of Rock Dreams fame — and the inner cover revealing a city gone to waste.Diamond Dogs is about a future world (any day now), over-mechanized and breaking down. As always, Bowie is topical. The urban decay of the album lyrics could be describing any city, but perhaps they most often evoke New York — the ultimate city. Diamond Dogs seems to exactly capture old mother-trucking, blood sucking Noo Yawk: from the hypodermic tip of the Vampire State Building to the subway depths of Transylvania Avenue.CollapseSo here I am in New York to hear the album, up in the offices of MainMan — the holding company for Bowie's operations. I'm sitting in Tony Defries' deluxe office, a spacious room where the Axminster tickles yer ankles, and I'm listening to the depiction of the collapse of a city. I sense a contradiction in this somewhere.A pile of Financial Times litter Mr Defries' desk, a box of the very best Havana cigars lie nearby, and there are memos detailing how the office potted-plants are to be cared for; and when you open a box of special Mainman matches, they've all got golden heads. Matches with many shiny golden heads, that burn with a vivid purple flame before blackening.Sitting back in the leather couch, I can just see down to Park Avenue, where the wheels of the city turn, and limousines whirr by. But less than a mile away, decay creeps in from Seventh Avenue, and up on Tenth Avenue it's slaughter. Mick Ronson's image is hung fifty feet high over Times Square, and under it, they're showing the first porno movie version of the Bible. New York.So when those opening words hiss by, spoken over an electronic orchestra, it means something. As the phrase ""This ain't rock 'n' roll, this is genocide"" ends the title song begins.It's a rocking raunchy number that owes a heavy debt to the Stones' Main Street album. A guitar chimes in, another churns the rhythm along, and a sax section blows a storm. All played by D. Bowie.""Angie bought me a baritone sax, so I've got the whole set now and I can do a brass section"". David later informs me, ""and I play all the guitars on this one, except for one bit on 1984 which is Alan Parker"".GhostlyHe's also playing a series of mellotrons and moog synthesizers, which give the first side of the album a ghostly mechanical effect. Between tracks you can hear those machines whirring and clicking away. They create the impression of a machine society, and yet it's still strange that an album which is about the break-down of an over-mechanized society should rely to so heavily upon machines. None of this album would be possible without 16-track tape machines, sophisticated recording studios, mellotrons, and moogs.Diamond Dogs runs to nearly six minutes long, and then cuts into a three-song sequence of nine minutes, comprising Sweet Thing, Candidate, and Sweet Thing Reprise. Bowie's voice on this section is just loaded with decay. Decay; mind you, not decadence. This album is the real thing.Rebel Rebel closes out side one on its lightest note. It's probably Bowie's best single, but it won't be released as such in America. At least three of the other four songs have obvious 'single-potential' though, so I'd take bets that an edited Diamond Dogs or 1984 hits the charts soon.Side Two has five songs, and kicks off with Rock 'n' Roll With Me which puts stress on the ""roll"" rather than the rock. It's slow, stately, and delicious. We Are The Dead was to have been the original title of the album, and in some ways, it's still the meat, but now it's just cut 2, side 2. A five-minute trip through a graphically depicted wasteland, where images of defecation and anesthesia are crammed together. This time, David isn't just playing with the idea of apocalypse: he's vividly visualizing the pattern of waste and decay, and giving us no starmen to rescue us from the future.FuturisticIt's slightly surprising to find the song 1984 here. It's part of the 1980 Floor Show project that Bowie may turn his attention to later this year. But here it is, fitting in perfectly with the futuristic pessimism of the album, and sounding like a movie theme toon.It's followed — logically enough — by Big Brother. ""We'll build a glass asylum, with just a touch of mayhem"" our controller tells us, of a Herb Alpert-like Moog and a heavy industrial hum. The song buzzes into the final number: Chant Of The Ever Circling Skeletal Family — an electronic study of less than two minutes, which fades for nearly half its length with an echoey eerie ""Right, right, right"".It's a strong and effective album, and certainly, the most impressive work Bowie's completed since Ziggy Stardust. The themes are like those of the more recent albums, but it also goes back to draw on the raw, ugly power that animated The Man Who Sold The World to offset the production tartiness of the newer records.The result is that where Aladdin Sane seemed like a series of Instamatic snapshots taken from weird angles, Diamond Dogs has the provoking quality of a thought-out painting that draws on all the deeper colors.Bowie's going to have to reproduce some of these effects on stage when he tours this year, and that was the subject when we talked last week. Having spent a week trying to arrange an interview (he doesn't do them) via various helpful but apologetic MainMen, one of them runs into the man himself at a 3 o'clock in the morning party given after Todd Rundgren's triumphal Carnegie concert.""God, I hate New York at times,"" David theatrically intones, as we get into the 'Englishmen-in-America' rap, ""and I've got to spent the next two months here getting the tour ready for a June 14 start in Montreal"". The tour then winds its way down through the mid-West to the East Coast, climaxing at Radio City in New York around the end of July.Not that David's simply gigging, he'll be making ""an extensive series of theatrical presentations"" — according to Mainman. ""Well, I've a feeling this may be the last big production type of tour that I do,"" Bowie tells me. Will it go to England? ""Oh yeah, sure,"" he replies. Even after all the 'Bowie Quits' headlines of one year ago? David breaks into a very wide grin. ""Yeah, well you really want to do it again, and I do like to play.""""Also, I'm putting a very good new band together. There'll be three people from the Diamond Dogs album, Mike Garson on piano again, Herbie Flowers on bass, yeah I managed to persuade Herbie to tour with me, and I y'know he's got to be the best bassist in the country, and there's Tony Newman who used to drum in the old Jeff Beck Group.""I've also been looking for guitars, and I've found a really incredible black guy called Carlos – just Carlos! – and there's another black guy I want to get to play guitar in the band. I want a really funky sound.""""Ever since I got to New York I've been going down to the Apollo in Harlem. Most New Yorkers seem scared to go there if they're white, but the music's incredible. I saw the Temptations and the Spinners together on the same bill there, and next week it's Marvin Gaye, incredible! I mean I love that kind of thing!""Have you heard Ann Peebles? Yeah, well Lennon's right, ain't he, best record in years. I mean that's what I'd like to do producing Lulu, take her to Memphis and get a really good band like Willie Mitchell's and do a whole album with her, which I will do.""Lulu's got this terrific voice, and it's been misdirected all this time, all these years. People laugh now, but they won't in two years time, you see! I produced a single with her — Can You Hear Me — and that's more the way she's going. She's got a real soul voice, she can get the feel of Aretha, but it's been so misdirected.""English singers do all this 'Oh yeah', 'Alright now' on soul songs, and it's wrong, but when she doesn't do that she just has the feel naturally.""DesignerApart from Lulu, what else has been happening for Bowie?""Oh, I just spent most of the time in London, there and in Paris, and I did some recording at Ludolf in Holland. Jagger uses that studio a lot, and he's done some really good songs there very recently, you'll hear It's Only Rock 'n' Roll Music [sic] soon, it's gotta be the single. Then I came here, now I'm working with Jules Fisher preparing the act for the tour.""He's working on the staging and lighting, and he's great. He just got an award for the lighting he did on Ulysses In Nighttown for Broadway, and he's worked on Hair and Lenny — a really great lighting designer.""""Then there's the new album, which will be out as soon as the cover art's OK'd by RCA. It's a painting of me changing into a dog, right and they're a bit worried that its cock shows. But apart from the cock, everything's alright""."
19,John Rockwell,New York,New York Times,07/21/74,Diamond Dogs,Pop Music : Bowie puts on lavish show at garden,"David Bowie (or just Bowie, as he prefers to be known now) has been attacked with an uncommon, even hysterical fervor in certain sections of the rock press for his latest album, “Diamond Dogs.” Because I hardly found the disk all that offensive, and because one purpose of rock ‘n’ roll is to outrage, there was every reason to approach his live show Friday night at Madison Square Garden with whetted expectations.And those expectations weren't entirely unfulfilled. The most disappointing thing, however, was not that Mr. Bowie was perverting rock ‘n’ roll or falling short of his own earlier standards, but that he hadn't yet begun to realize his own potential as a man of the theater.Mr. Bowie's first records, back in the mid‐nineteen‐sixties, showed a hesitant rocker indeed. His real roots seemed to lie in the British music hall and the Continental cabaret song, with a strong twist of Marcel Marceau mime thrown into the balance.By the late sixties, however, Mr. Bowie had emerged as a real rock ‘n’ roll star, albeit a rather extraterrestrial one. Ever since his hit, “Space Oddity,” he has stuck close to the themes of science‐fantasy as a metaphor for teen‐age rock alienation and the drug experience. It is an evocative set of themes, if you respond to them at all, and Mr. Bowie's songs—both words and music—have a real potency to them, even the maligned surrealistic nihilistic “Diamond Dogs” LP.But Mr. Bowie has always been much more than a freaky android rock star. He is best known, of course, as a self‐professed bisexual glitter‐theater wizard.Continue reading the main storyGlitter and rock theatrics are by no means identical, of course. But in recent years they have become inextricably entwined. Glitter, on the one hand, is the principal fashion and (fantasy?) life‐style of a large minority of young people mostly in such centers as London, New York and Los Angeles. You don't have to be homosexual or bisexual to be a glitterer, although it may help. Sparkling platform shoes, eccentric make‐up, lots of feathers are today's answer to the rebellious black leather jackets of yesteryear.Theatrics is simpler to understand, and marginally less controversial. More and more rock hands have lost interest in the more bovine kind of concert, wherein bands stand in stoned stolidity and just play.Glitter is either a portentof the future sexual norm, an overhyped fad or a moral scourge, depending on where you sit. Theatrics is either the wave of the rock future or a pretentious distortion of rock's musical basics and an admission of musical failure, depending on how you hear. in combining the two, so assertively, Mr. Bowie has assured himself a prominent place in our attentions.His place isn't prominent enough to be a super superstar, however, at least not quite yet, “Diamond Dogs” was No. 5 with a bullet on the Billboard chart last Monday, but it is hardly an automatic, long‐lasting No. 1. And Madison Square Garden wasn't quite sold out Friday (the second show, last night, had been announced first and was reportedly a sellout)—even after a barrage of advertisements.Those who came got a pretty lavish show. Mr. Bowie has a good band behind him, including two agile dancer‐chorus members, and he sounded in remarkably good voice, considering the rigors of a tour. His repertory was built around the new album, but dipped freely back into his past reposiofMr. Bowie himself looked very good and moved very well indeed. He is modishly emaciated, and his dyed orange‐red, shagged hair frames a face quite perfect as either a man's or a woman's. He has a dancer's body and a fashion model's way with clothes.The set and lighting, too, were craftily planned, full of elevator platforms, scaffoldings and extending booms, and holding a variety of movable props. The 100minute production was tightly executed and reasonably well‐paced, and if spontaneity was in short supply, professionalism and energetic precision almost made up for it.But there was one problem, and it was a big one. For all his theatricality, Mr. Bowie failed quite completely to build his show toward a big finale. For all the momentary appeal of the effects and the short‐range success of the pacing, there was little coherence to the evening. A routine would end, a special effect would unfurl, and then tension would snag and snap.When Mr. Bowie can offer us an evening‐long rocktheatrical entity to match his technical expertise and his conceptual ambitions, we may really have something. Until then, for all the striking incident and over‐all aura, he is just fussing around, however gaudily."
