numéro,auteur,Pays revue,revue,date,album,titre,texte
1,Penny Valentine,London,Disc and Music Echo,10/10/69,Man of Words,DAVID BOWIE - AMAZING SOUND !,"I have a bet on in the office that this is going to be a huge hit - and knock everyone senseless.There are disbelievers among us! David Bowie has always been talented but had a nasty knack of sounding like Tony Newley.Good records came from him but nothing to actually make you fall over. This does though.In fact I listened spellbound throughout, panting to know the outcome of poor Major Tom and his trip into the outer hemisphere.Apart from that - and some really clever lyrics - the sound is amazing. Mr. Bowie sounds like the Bee-Gees on their best record - New York Mining Disaster - and has managed to arrange the backing to sound like a cross between the Moody Blues, Beatles and Simon and Garfunkel.It's obviously going to do well in America, which is nice."
2,Tony Palmer,London,The Observer,12/07/69,Man of Words,UP-TO-DATE MINSTREL,"DAVID BOWIE first came to notice with the spectacularly good song called Space Oddity which surfaced in the charts a month or so ago. He then gave a sizzling concert in London's Purcell Room which was mostly ignored by the national press, presumably because they thought pop and Purcell were incompatible. Now he has released an LP of songs - including Space Oddity - called simply David Bowie (SBL 7912).On stage, he is quite devastatingly beautiful. With his loofah hair and blue eyes, he pads around like every schoolgirl's wonder movie-star. He smiles; you melt. He winks; you disintegrate. He fumbles away on his twelve-string acoustic guitar with ferocious gusto. He apologises that his repertoire is mostly his own songs, which he admits sound all very much the same.It's all relaxed, chatty, informal and you forgive him his husky voice, his strained top notes and his careless intonation. You slump back, allowing this contemporary minstrel to dazzle you with niceness. Then, suddenly, he tears into you with a violent, passionate, angry, stamping song about fear and despair - 'Our weapons were the tongues of crying rage', he shouts. Using the imagery of war and sudden death, he offers simple homilies of charity and kindliness. 'My head's full of murders/Where only killers scream', he warns.Bowie is 22 and was born in Brixton, London, but grew up in Bromley, Kent. He now lives in Beckenham and is trying, without success, to rouse enough interest to start a local Arts Lab, modelled on Jim Haynes's now defunct Drury Lane organisation. He's also moving into acting, after a miniature appearance in The Virgin Soldiers. His love reveries are dreary, self-pitying and monotonous. But when he turns his eye to the absurdities of technological society, he is razor-sharp in his observations (although the sound production on his records does its best to obscure this), especially in the exquisitely scored version of his hit single, Space Oddity. At a time when we cling pathetically to every moonman's dribbling joke, when we admire unquestioningly the so-called achievement of our helmeted heroes without wondering whey they are there at all, Bowie sings of a man called Major Tom who sets off from Cape Kennedy and just never bothers to come back. To the bewilderment of Ground Control, he just waves a sad goodbye to his wife and then shuts off the communication circuits."
3,Nancy Elrich,New York,New York Times,07/11/71,Man of Words,"Bowie bolan Heron, superstars?","FROM time to time in the history of pop music, an artist has created a record that has shaken the medium to Its foundations with the force of originality, leaving its impact on every record to follow. “Sgt. Pepper” did that. “Sweet Baby James” did. “Meet the Beatles” changed the whole world. But most often a per former who has something original to say is dismissed as being too far out for the gen eral public to appreciate, and he becomes, at best, the lead er of a small cult of devoted fans.The American general public, however, is a pretty sophisticated audience by now. We've learned that music can be more than entertainment and that listening to a songwriter on his own terms can be a very rewarding kind of hard work. It may be the moment for some of these cults to expand, and if it is, the first new superstars to appear will he David Bowie, Marc Bolan, and Mike Heron, three British songwriters whose work has nothing in common except the fact that it is all intensely original.Bolan is singer, writer and mastermind for the English rock group T. Rex (shortened from Tyrannosaurus), who have a current album of the same name (Reprise). Bolan is rock and roll with a difference. Lots of the standard rhythms and chord structures are there, but transformed, stylized, magnified out of all usual proportion. Bolan loves bigness and artifice, legen dary grandeur and simple size. His lyrics are full of sorcery and a fondness for the medieval, or for any set ting in which the grand ges ture is appropriate. He cre ates his own setting by the deliberate exaggeration of everything he touches: an electric guitar that hiccups and leaps in the background; vowels sung in a strange, af fected accent; a forced vi brato that shudders like a sine curve with pneumonia.His words, easily mistaken for obscure poetry, are sim ply masterful song lyrics, chosen for their sound and mood, for their ability to glide or chug along with the mel ody and, always, for their sweeping images of the natural and supernatural. The exaggeration is so tasteful and thorough that Bolan ends up with a surprisingly coherent balance. Like a picture blown up to larger-than-life size, the music seems strange and disconcerting at first, but it turns out to be in perfect proportion in relation to it self.The T. Rex album is most ly meant for fun, but there is an underlying seriousness to it. Bolan's one nonmagical theme, and his most persistent fantasy, is the complete and willing communication of people with people. In the context of his songs, the meeting of one individual with another is a celebration in itself, because of all the giving and sharing it implies. A fantasy, yes, but one worth falling into. The trick is to suspend the usual demands of a realistic life and enter into Bolan's world, where the demons are harmless and the misician-sorcerers are sworn: . . . to give every child The chance to dance.Continue reading the main storyLess consistent but equal ly original is a recent solo album by Mike Heron of the Incredible String Band. The record, Smiling Men With Bad Reputations (Elektra), is a continuation and variation of the adventures in musical synthesis that Heron and Robin Williamson have been creating with the String Band over the past several years. As a solo artist, Heron falls into some of the same lapses that mar ISB records: un structured, unlearnahle melo dies; songs that tend to drag on too long; some lyrical clumsiness. But what he does in between is remarkable enough to merit attention and patience.Heron draws on every thing; his musical source is the world. Middle Eastern rhythms and English ballads and American rock and roll not only alternate and interact, Put merge to form something that tounds ?? all of them at once. This is not mere folk-rock or raga-rock, the use of strange instru ments or imported arrange ments to give a standard song an unusual flavor. It's an ac tual meeting-ground for wide ly different musical media that would have seemed ir reconcilable if Heron (or in another context, Heron and Williamson) didn't take them all gracefully in his stride.The masterpiece of the al bum is a strikingly arranged song called “Spirit Beautiful,” accompanied by several unpronounceable Middle Eastern instruments and full of lots of Oriental and Occidental mysticism. In a very few words and notes, Heron creates and transforms scenes and landscapes that have a definite visual impact. He is a skilled conjurer, and when it works, it works very well. Magic and music have always complemented each other.Mind and music are a pow erful team, too, David Bowie is the most intellectually brilliant man yet to choose the long-playing album as, his medium of expression. His best album is Man of Words/ Man of Music (Mercury). It is over a year old and not easy to find in record stores, but it is well worth special ordering or sending to Eng land for or borrowing from a friend. It is worth any three records now on the charts.“Man of Words” is a com plete album, as full in every detail as the precise, reso nant tone of Bowie's 12-string guitar and the flexible power of his voice. Taken on its simplest level, it is a good collection of rock material, full in its variety, melodically interesting, flawlessly and tastefully arranged and pro duced. It could have been a compelling piece of music with no words at all.The lyrics add another di mension and almost endless layers of meaning. Bowie does nothing simply, includes noth ing that is not meticulously thought out, its implications weighed, its emphasis calcu lated. He chooses to narrate or illustrate specific situa tions which can be taken both on a story level and on an implied, philosophical one. It is not allegory so much as microcosm: one small example of something generally true.He draws an astronaut lost and floating above the moon, whose hopeless isolation is less awful than the earth bound loneliness that it calls to mind. He creates a woman overburdened with con science and fear, plagued with the terror that God might really not understand. There are lovers, too, who sing in brief moments of gen tleness between the more vio lent and wrenching statements.Bowie's most powerful theme is the persecution and corruption of original think ing. With originality he links the understanding and com passion that are destroyed by the comfortable, dehumanizing effect of slogans and laws. In a long and unusually struc tured song called “The Cygnet Committee,” he sings the problem from all perspectives: that of the exploited, the exploiters and his own anguished position of being caught in the middle. The original thinker has no way out. His ideas are crushed and misused, or if he wins in the end (as in another Bowie song, “Wild Eyed Boy from Freecloud”) he is bur dened with compassion for the defeated.It is a complete, coherent and brilliant vision that Bowie has created, one of the few proofs of the fact that what used to be rock and roll is now a limitless form of expression. But limits are always lurking around the corner, waiting to reassert themselves. As Bowie well knows, they always will. The day will come when David Bowie is a star and the crushed remains of his melodies are broadcast from Muzak boxes in every elevator and hotel lobby in town."
4,John Mendelsohn,San Francisco,Rolling Stone,02/18/71,The Man Who Sold The World,,"“Some say the view is crazy/But you may adopt another point of view. So if it’s much too hazy. You can leave my friend and me with fond adieu,” sings David Bowie in The Man Who Sold The World, thus supplying a most cogent critique of his own recent work — Bowie’s music offers an experience that is as intriguing as it is chilling, but only to the listener sufficiently together to withstand its schizophrenia.Bowie deals throughout this second album in oblique and fragmented images that are almost impenetrable separately but which convey with effectiveness an ironic and bitter sense of the world when considered together. His unhappy relationship with the world is traced to his inability to perceive it sanely: “I’d rather stay here with all the madmen/Than perish with the sadmen roaming free. I’m quite content they’re all as sane as me.”Producer Tony Visconti’s use of echo, phasing, and other techniques on Bowie’s voice to achieve a weird and supernatural tone reminiscent of a robot (which is to imply not that Bowie sings mechanically, but that his voice is oddly metallic to begin with) serves to reinforce the jaggedness of Bowie’s words and music, the latter played in intimidatingly heavy fashion by an occasionally brilliant (note Mick Ronson’s guitar break in “She Shook Me Cold”) quartet guided by Visconti’s own maniacally sliding bass.In an album that, save for the impotently sarcastic “Running Gun Blues,” is uniformly excellent, at least four tracks demand special attention: “Saviour Machine” demonstrates that Bowie far from exhausted his talent for quietly moralistic rock sci-fi in his earlier “Space Oddity.” The almost insufferably depressive “After All” contains the strangest refrain perhaps ever conceived — a haunting, mantric “Oh, by jingo.” “The Width of the Circle” is both a hallucination with religious overtones that recall both Dante and Adam and Eve and a sound of enormity. And “She Shook Me Cold” contains some of the most bizarre sexual imagery ever committed to vinyl: “She sucked my dormant will,” or “She took my head, smashed it up/And left my young blood rising.”You ambitious young film makers out there contemplating a brilliantly evocative psychologically-oriented film about despair, consider Kevin Ayers and then eventually decide on David Bowie to do the score."
5,John Mendelsohn,San Francisco,Rolling Stone,01/06/72,Hunky Dory,Hunky Dory,"avid Bowie, the swinging/mod Garbo, male femme fatale, confidante to and darling of the avant garde on both sides of the Atlantic, and shameless outrage, is back, and with a bang, although bearing little resemblance to the dangerous loony of The Man Who Sold The World from earlier this year.For the most part, Dave is back, after an affair with heavy! highenergy killer techniques, back into his 1966-ish, Tony Newley/poprock thang, and happily so: Hunky is his most easily accessible, and thus most readily enjoyable work since his Man Of Words/Man of Music album of 1969.Much of The Man Who Sold’s appeal is derived from the incredible ferocity of Bowie’s accompanist’s instrumental backing and from Tony Visconti’s masterful production, which propelled it into a tie with the Move’s Shazam for the title of the best-recorded and-mixed heavy! album of all eternity. Relative to Bowie’s own talents it was erratic in the extreme, tedious music and hopelessly obscure (and sometimes downright embarrassing) words alternating frequently within the space of a verse with exciting melodic phrases and poignant, incisive lyrics.Hunky Dory not only represents Bowie’s most engaging album musically, but also finds him once more writing literally enough to let the listener examine his ideas comfortably, without having to withstand a barrage of seemingly impregnable verbiage before getting at an idea — only in “The Bewlay Brothers” does he succumb to the temptation to grant his poetic faculties completely free rein, and there with expectedly frustrating results.Here the backing, including strings, doesn’t oppress him as it sometimes did in The Man, but rather creates a casual pop atmosphere in which Dave’s voice, which loves to entertain company, is free to perform all manner of little tricks for us. To top all of this off, Ken Scott’s production is quite splendid — delicious little flourishes of the sort that the casual listener will not detect but that one who gives the record a few serious spins will find thrilling abound, like, say, Mick Ronson’s guitar suddenly beginning to echo distantly at the onset of a solo.While compiling material for this album Dave’s thoughts apparently turned frequently to the imminence of the birth of his first son, Zowie, which preoccupation is reflected in the album’s two obvious candidates for release as a single, “Oh! You Pretty Things” and “Kooks.” The former, which was a hit in England for Herman Hermit, intimates that homo superior — the superman race — is about to emerge, implicitly in the form of the wee Bowie. “Kooks,” which is even catchier, finds Dave urging the infant to stick around with his folks, shameless aberrants though they may be, with such lines as, “Don’t pick fights with the bullies or the cads/’Cause I’m not much cop at punching other, people’s Dads,” revealing remarkable self-candor on Papa’s part.“Eight Line Poem,” which is tacked onto the end of “Pretty Things” for reasons obvious only to Dave, is musically blah but boasts the following haiku-ish couplet or whatever at its conclusion: “But the key to the city/Is in the sun that pins the branches to the sky.”“Changes” has an irresistible stuttered chorus sung by dozens of overdubbed Daves alternating with faintly Newley-ishly-delivered verses that may be construed as a young man’s attempt to reckon how he’ll react when it’s his time to be on the maligned side of the generation schism.“Quicksand,” a melodically lovely affair that boasts superb singing from Dave and a beautiful guitar motif from Mick Ronson, also speaks of confusion. Through two verses it’s typical erratic Bowie — a flaccid, strained image in the same breath with an extremely effective one (as in “I’m the twisted name on Garbo’s eyes/I’m living proof of Churchill’s lies”), until in the third it abruptly becomes clear and controlled as it betrays the paradoxes the Bowie intellect finds most troubling:I’m not a prophet or a stone age manJust a mortal with potential of a supermanI’m living onI’m tethered to the logic of homo sapienCan’t take my eyes from the great salvationOf bullshit faith…A delightfully and appropriately good-natured rendition of Biff Rose’s sprightly “Fill Your Heart” opens side two, ending with a truly deft swoop into falsetto by the Bowie vocal chords and a taste of the provocative Bowie saxophone, heretofore left un-unveiled on the Bowie records.Then Dave falters momentarily with two tunes that suggest to Lewis Segal and other astute Bowie-watchers that the lad’s tongue may be less firmly against his cheek than originally suspected when he suggests that he is in the vanguard of, and therefore a qualified commentator on, hip and avant — garde goings — on — both “Andy Warhol,” whose only notable feature is its extraordinary all-acoustic-guitar accompaniment, and “Song For Bob Dylan” impress even these unastute ears as self-indulgent and trivial.“Queen Bitch,” though, with a vocal right out of Lou Reed and an arrangement right out of the Velvet Underground and a theme right out of the novel of the same name, is fascinating and scandalous, describing a “swishy … Queen” successfully hustling the singer’s boyfriend. And after all this reviewer did to portray Dave as a clean-cut normal in these pages!“The Bewlay Brothers” sounds like something that got left off The Man Who Sold because it wasn’t loud enough. Musically it’s quiet and barren and sinister, lyrically virtually impenetrable — a stream-of-consciousness stream of strange and (seemingly) unrelated imagery — and it closes with several repetitions of a chilling chorus sung in a broad Cockney accent, which, if it’s any help, David usually invokes when he’s attempting to communicate something about the impossibility of ever completely transcending the mundane circumstances of one’s birth.And there you have it. With his affection for using intriguing and unusual themes in musical settings that most rock “artists” would dismiss with a quick fart as old-fashioned and uncool, he’s definitely an original, is David Bowie, and as such will one day make an album that will induce us homo superior elitist rock critics to race about like a chicken with its head lopped off when he learns that he’s a couple of pretentious tendencies he’d do handsomely to curtail through the composition of an album’s-worth of material. Until that time, Hunky Dory will suffice hunky-dorily."
