numéro,auteur,Pays revue,revue,date,album,titre,texte
46,Rick Moody,New York,New York Times,09/10/95,Outside,Returning To the Sound Of Those Golden Years,"David Bowie, whose album ""Let's Dance"" was one of the hippest of the 80's, couldn't feel worse about that decade now. ""The worst thing that could have happened to me was to have a big hit with 'Let's Dance,' "" he said. ""I had never been popular with the masses, and suddenly I was in this place where I was on bubble gum wrappers. I thought, 'What do I do with this?' ""In the 70's, of course, Mr. Bowie, who was born and raised in London, turned out some of the most innovative popular music on either side of the Atlantic, beginning with the aptly named ""Space Oddity"" in 1972 and culminating, in 1977, with a pair of albums that rank among rock-and-roll's most inventive, ""Low"" and ""Heroes."" In New Hampshire, where I was warehoused (at boarding school) for the 70's, no party was complete without a succession of Mr. Bowie's funk-modernist grooves. ""Suffragette City,"" ""Rebel Rebel,"" ""Fame"" -- all his hits adorned our gymnasium dances.TEXT:This period of great fertility in which Mr. Bowie inspired a thousand bands (from Duran Duran to Elastica) and acted memorably both in film (""The Man Who Fell to Earth"" and ""The Hunger"") and on stage (""The Elephant Man"") seemed to reach its zenith with the blue-eyed soul of ""Let's Dance"" (1983).I never liked 'Let's Dance' much either. It was slick, calculating, and it wasn't dark. In the 70's, Mr. Bowie's songs had titles like ""Rock-and-Roll Suicide"" and ""We Are the Dead,"" and these tragicomic grooves made popular music seem more ambitious, worldly, vigorous. As a fan of his earlier work, therefore, I was excited to find that Mr. Bowie's forthcoming Virgin release ""Outside"" not only reunites him with the producer Brian Eno -- collaborator on ""Low"" and ""Heroes"" -- but also recaptures the cool menace that propelled Mr. Bowie's music two decades ago. ""Outside,"" in fact, is an album fashioned entirely of Mr. Bowie's fragmented and grim meditations on the murder, in 1999, of a young girl named Baby Grace Blue, whose body is thereafter exhibited by an unknown ""artist/assailant."" (The album reaches stores on Sept. 26, a day before Mr. Bowie's fall tour, with Nine Inch Nails, arrives at the Meadowlands Arena.)Trying to get Mr. Bowie, at 48, to answer a question about this new work, though, is a little like trying to get a jazz saxophonist to finish up a solo -- he riffs and extemporizes, veering passionately from opinion to opinion. Yet as I spoke with Mr. Bowie in his Fifth Avenue office, it became evident that his conversational eruptions revealed as much about his recent music as the substance of his remarks.To avoid the mass-market calculation of his recordings in the 80's, Mr. Bowie and Mr. Eno created for ""Outside"" an atmosphere of play and improvisation using a crack band of longtime Bowie collaborators: Reeves Gabrels, the guitarist in Mr. Bowie's late-80's band, Tin Machine; Mike Garson, the pianist on the album ""Alladdin Sane""; Carlos Alomar, the session guitarist of choice on hits like ""Fame"" and ""Golden Years,"" and Mr. Eno himself, on synthesizer and digital sampler.""Outside"" began in early 1994 with a sort of a fact-finding mission by Mr. Bowie and Mr. Eno to the Gugging psychiatric hospital near Vienna, where they interviewed and photographed its celebrated artist-patients. The artwork of these men (""massively free and improvised,"" Mr. Bowie said), sometimes referred to as Outsider Art, had a powerful influence on production strategies for the new record. The recording sessions for ""Outside"" began immediately afterward, and even included some of the artistic materials favored by the Gugging's residents. ""I made sure there were lots of paints and charcoals and drawing things around,"" Mr. Bowie recalled, ""so that people could just stay in a place they wouldn't normally be in in a recording studio.""Thereafter, at the beginning of each session, Mr. Eno presented each of the musicians with a ""flash card."" ""Each card would determine their character,"" Mr. Bowie said, ""for at least the beginning of the improvisation. Things like: 'You are a disgruntled ex-member of the Clash and are wanting to set up a competitive band.' "" One of Mr. Bowie's own flash cards was more direct: ""Mine said I was a soothsayer or town crier."" The technique, Mr. Eno explained, was based on party games: ""When you give people a game role, you say to them, 'Oh, go on. Try something.' ""Iggy Pop, an American musician who hired Mr. Bowie as a producer (""because he was doing better work than anyone else"") on two assaultive albums in the 70's, ""Lust for Life"" and ""The Idiot,"" also remembers from his own sessions a studio chemistry founded on the spontaneous and the impulsive. ""That's what made those records great, and I certainly credit him,"" Mr. Pop said of Mr. Bowie. ""For a song like 'Fun Time,' I had the idea and the vocal, and he came up with the advice 'Don't sing it like that, sing it like Mae West.' And that was a great stage direction.""Mr. Bowie's lyrics for ""Outside"" were also improvised. ""I work about 40 percent of the time with the William Burroughs-Brion Gysin cut-up method,"" he said. In the digital age, this cut-and-paste process relies on a Macintosh computer. ""I feed into it the fodder, and it spews out reams of paper with these arbitrary combinations of words and phrases,"" Mr. Bowie said.During the band improvisations for ""Outside,"" he simply gathered up these assemblages -- culled, in part, from articles on the Outsider Artists -- and began to sing. ""That's the point,"" he said, ""just improvising off these lyric sheets."" Mr. Eno compares Mr. Bowie's unusual lyrical strategies to evolution: ""Natural selection, you know, throws out all these mutations, and a few of them get saved. The lyrics that got saved here, they would get fed back into the computer. So the brew kept getting enriched. It was the most amazing thing to see.""Wait a second. Flash cards? Improvised lyrics? An album about ritual murder? It doesn't sound like the middle-of-the-road balladeer who sang the lyrics ""Get me to the church on time"" on the 1983 monster smash ""Modern Love,"" or who crooned his way through any number of cookie-cutter follow-ups on ""Tonight"" (1984) or ""Never Let Me Down"" (1987). Mr. Bowie confronts this chapter in his career ruefully. He succumbed in those years, he said, to ""that device of using format"" to sell albums.IF THE 90'S ARE ALREADY Proving more inspiring to him, however, it may be for one simple reason: the fin de siecle. Above all, the ominous fact of the millennium seems to have engendered the gruesome story of ""Outside."" ""All this imagery just started to make sense in light of the stereotypical behavior that happens toward the end of the century,"" he said. ""A vague desperation sets in. Morals become a great issue. I just sort of ran with it.""In fact, Mr. Bowie is so invigorated by this millennial sang-froid that he imagines the narrative of Baby Grace Blue's murder continuing through his next four albums. One a year. Until, well, December 1999. ""The idea of documenting the last five years of this millennium is something that I just cannot miss doing,"" he said. And then? ""Then what I would like very much to do is present it as a stage piece, maybe over two or three days. As a piece of monumental, epic theater.""The enthusiasm in Mr. Bowie's comments about ""Outside"" is also apparent in the music itself. By returning to the kind of apocalyptic unease that marked earlier records like ""Diamond Dogs"" or ""Low,"" by reuniting with Mr. Eno -- the only producer in the last 15 years who has found the plaintiveness in Mr. Bowie's voice -- and by assembling a band willing to play and work with ideas, David Bowie has made a recording that forces comparisons with his finest albums of the 70's.It is a suite of hard-core dance songs that showcases a deranged lounge piano as the lead instrument, that avoids the stiffness of electronic music and that has recitative passages in which Mr. Bowie acts out three or four different characters' voices (with a demonic glee). Best of all, ""Outside"" manages to rock convincingly, to keen and to arrest. In fact, it just might restore him to his position of eminence at those American high school dances.So as Mr. Bowie leans back from the glass table in his office, lights another cigarette and begins to extemporize -- about his role as Andy Warhol in the forthcoming film by the painter Julian Schnabel, about his own painting, or simply about the consolations of marriage and family (he's married to the model Iman and has a son, Joe, from a previous marriage, now a doctoral student in philosophy) -- he's understandably excitable. He spent a decade on the outside. "
47,David Fricke,San Francisco,Rolling Stone,10/19/95,Outside,album Review,"David Bowie has made a career of being anything and everything other than himself. As rock & roll’s consummate quick-change artist, he has created some of the greatest leading roles in the pop-art theater of the imagination: the bisexual charmer of Hunky Dory; the star-crossed alien lipstick-killer Ziggy Stardust; the white-soul dandy of Young Americans; that vampiric-looking beanpole the Thin White Duke; the disco sophisticate of Let’s Dance.But Outside, Bowie’s first album since his 1993 debacle, Black Tie, White Noise — and a highly anticipated studio reunion with Brian Eno, the co-architect of Bowie’s bench-mark Berlin trilogy Low, “Heroes” and Lodger — is way too much of a good thing. Bowie’s almost pathological fear of dropping all the masks, of simply reveling in the power of a good chorus and the soulful quiver of his maturing tenor, has driven him into multiple-personality overdrive and forced melodrama. The music — a potent collection of avant-garage riffs and rhythm notions co-written mostly with Eno and echoing the weird science of Low and “Heroes” — feels shoehorned into the script with frustrating rigidity.It didn’t have to be that way. When his voice isn’t being abused by synthetic effects to suit some plot device, Bowie sings with full-bodied vigor and an affecting drama that suits the burned-orange tinge of his and Eno’s industrial-apocalypse soundscapes. Bowie digs into the plastic rattling funk of “Thru’ These Architects Eyes” with a ragged enthusiasm, and his simple, shattering delivery of the words I shake in “The Voyeur of Utter Destruction (As Beauty)” broadcasts the homicidal delirium of the song much more effectively than the heavymental title.Indeed, it’s the superfluous wordage — the intrusive spoken monologues, the jury-rigged cybernoir narrative, the overelaborate characterizations — that damn near sink the record. You can practically feel the weight of Bowie’s own description of his story line: “A nonlinear Gothic drama hypercycle.” Outside is really just a confusing highbrow detective fable — Sam Spade meets Neuromancer via Naked Lunch — laid out as the diary of Nathan Adler, a futurist shamus specializing in art-crime investigations (as opposed to crimes against art, which too often go unpunished in real life).On Outside, Adler is wrapped up a little too tightly in the high-concept ritual murder of Baby Grace Blue, an adolescent of undetermined sexuality. A colorful parade of riffraff with nifty handles like Algeria Touchshriek passes through the diary entries, but nothing much happens aside from Bowie and Adler’s fevered meditations on sculpted gore and the violent possibilities of self-expression. (Best line: “Art’s a farmyard. It’s my job to pick thru the manure heap for the peppercorns.”)All that explication belies the smart, sharp stab of Bowie’s more effective lyric writing. The lines “Poor dunce/He pushed back the pigmen/The Barbs laughed/The fool is dead” in “A Small Plot of Land,” a looping piece of freakcabaret jazz, say much more about the long dark shadows and desperate, clawing evil poisoning of the Outside world than all of Bowie’s prose wordplay. “I Have Not Been to Oxford Town,” the jail-house lament of a petty thief falsely accused of the murder, is delivered by Bowie with a nice slice of wry: “And the prison priests are decent/My attorney seems sincere/I fear my days are numbered.” (Also note the song’s sly reference to Bowie’s 1975 hit, “Fame,” in the skittering, metallic rhythm guitar.)Taken in parts (a bit like the poor, disassembled Baby Grace), Outside has irresistible charms: the tense Euro-dance propulsion of “The Hearts Filthy Lesson”; the layered, circular-guitar locomotion of “Voyeur…,” like Philip Glass in a King Crimson mood. “Hello Space-boy” is the sound of Bowie and Eno going nuclear on Trent Reznor’s death-disco dance floor, hot-wiring the migraine gallop of Iggy Pop’s “Lust for Life” into a ferociously distorted whirl of slaughterhouse jive.It’s too bad that Bowie and Eno don’t allow themselves the luxury of a straightforward pop song until the very end. You have to wade through 19 tracks of conceptual mischief to get to the simple melodic development and swelling chorus of “Strangers When We Meet.” The song doesn’t do much for Outside‘s lack of dramatic resolution (the last line in Adler’s diary is “To be continued….”). But it shows that Eno can whip up great, uncomplicated pop when he lets his egghead defenses down and that in Bowie’s best work, a little drama still goes a long way."
48,Paul Gorman,,Miller Freeman Ent.,01/20/97,Earthling,Invigorated by Nineties sounds,"There's nothing the media enjoy more than an anniversary and David Bowie's 50th birthday on January 8 offered ample opportunity for career retrospectives/dissections in the form of two TV specials, a Radio One acoustic broadcast and a star-studded celebratory New York concert.The past decade has not featured highly in many people's critical overview of his career, but that has been to ignore a steady recent musical regeneration, hinted at on the Buddha Of Suburbia and Black Tie White Noise in the early Nineties, and more evident on 1995's Outside, his most rounded effort in years.The revival continues with the hot new post-Prodigy single, Little Wonder, and forthcoming album, Earthling, which sees Bowie throwing down a hard rock/alternative dance gauntlet to performers half his age.According to Bowie, 50 feels good, possibly because he is in as fine fettle musically as he is physically. Earthling is a testament to the rejuvenating powers of techno, industrial and drum & bass with Bowie supported by the other-worldly guitar technique of Reeves Gabrels, piano gymnastics of Mike Garson, drummer Zachary Alford and bass-player Gail Ann Dorsey.On tracks like the self-deprecating single Little Wonder, the epic Seven Years In Tibet and the moody Dead Man Walking, it is evident that Bowie has regained his confidence in the studio. ""The energy level and dynamics of Earthling come from us developing as a working band which enjoys playing live, particularly at the festivals,"" he says.As with his 1973 album, Aladdin Sane, most of the material on Earthling was written on the road. ""It's almost as though we duplicated the live experience in the studio,"" says Bowie, who stresses that everything was recorded in eight days flat.Bowie's songwriting collaboration with Gabrels runs along different lines to that with Brian Eno - his partner on the acclaimed Low/Heroes/Lodger trilogy. ""Reeves and I work in essentially the same way, we have virtually the same sense of perspective,"" says Bowie. ""There is more of a bond concerning musical ideas, whereas Brian and I often start from different directions - he has a pretty set idea of where he wants to go, as do I. That's what makes it interesting.""The release of Little Wonder has emphasised Bowie's conversion to drum & bass: two tracks on Outside also contained jungle elements and he reworked the classic The Man Who Sold The World in that style for single release last year. However, he points out that the genre's rhythms are only detectable on three songs on the new album. ""There's also a lot of pure industrial on there, and one track, The Last Thing You Should Do, even goes back to the area I was working on with Low; it's not that dissimilar from Sound & Vision,"" he says.RCA marketing director Kristina Kyriacou says that the record company will be pressing home the message that Earthling represents Bowie's most accessible work for some time. ""It's a lot more commercial than his recent albums and we believe that it has a great deal of longevity,"" she says. ""Earthling is a very dynamic, bold statement and we aim to reflect that.""Kyriacou adds that Bowie is always open to new ideas. ""Although he essentially delivers the album to us, we all have a say in how it should be presented,"" says Kyriacou, who points out that club promotions for Little Wonder centre on the mixes for the record by leading dance names like Junior Vasquez, Adam F, Leftfield and Danny Sabre. ""The idea of this album was to take techno ideas and reproduce them with organic instruments,"" says Bowie. ""I find drum & bass very exciting, but my approach isn't hardcore. I just enjoy listening to it and then putting that into a hard rock context.""Given his musical roots in British R&B, rock and glam, an easier route to re-establishing credibility may have been for Bowie to plug into the post-Britpop boom, but his desire to experiment would not allow him to. ""I didn't go that way because I'm a stubborn git,"" he says. ""I go with my enthusiasms and although I think rock is a great artform, I've never had a predilection for that kind of formulaic sound.""Bowie's wayward muse may never lead him back to the creative heights he scaled in the Seventies, but it ensures that he remains at the centre of a diverse range of projects. Aside from a return to the road with his band in May and plans to record the next in the ""pre-millennium tension"" series with Eno this summer, he also intends to produce a solo album by bassist Gail Ann Dorsey.And Bowie is not neglecting the visual arts; next month's Milestones exhibition/auction in aid of War Child will feature his artistic tribute to Sixties singers The Walker Brothers.Bowie's admiration for Scott Walker dates back to the mid-Sixties and he has subsequently followed the enigmatic artist's solo career with avid interest. In fact, Walker approached Bowie and Eno with plans for collaboration in the wake of Heroes, but these were never realised. ""One of the few ambitions I have left is to work with Scott Walker,"" says Bowie. ""He's a pioneer and a renegade, an artist who is a great role model.""The vigour displayed on Earthling guarantees that this description is equally applicable to Bowie himself."
49,Ann Powers,New York,New York Times,10/15/97,Earthling,POP REVIEW; Not Ready for Golden Oldies,"David Bowie, science-fiction fan, transported himself into an alternate reality on Monday night at the Supper Club, emerging as the leader of a dance band at the edge of time. Pop's master of artifice pulled a grand illusion by mixing his classics with material from his modestly successful new album, ''Earthling'' (Virgin), and refusing to make the slightest distinctions. Mr. Bowie, who hasn't had a genuine hit in over a decade, might be expected to rest on his plastic laurels, but instead he mocked that role, erasing history's ups and downs by acting as if every song he performed were a chart-topping smash right now.At first, when Mr. Bowie strolled onstage strumming an acoustic guitar, it seemed that the evening would be a far simpler nostalgia trip. Chuckling while he crooned ''Quicksand,'' from 1971, Mr. Bowie seemed ready for memory lane. His band -- Reeves Gabrels on guitar, Gail Ann Dorsey on bass, Mike Garson on keyboard and Zachary Alford on drums -- assembled and began ''Always Crashing in the Same Car,'' one of Mr. Bowie's prescient late-1970's ambient-music collaborations with Brian Eno. Though interrupted by ''I Can't Read,'' from the soundtrack for the current film ''The Ice Storm,'' Mr. Bowie's glam-rock-era hit ''Jean Genie'' and the Velvet Underground's ''Waiting for My Man'' set a pleasantly retrospective mood.Then, in the echo of the audience's screams for ''Jean Genie,'' Mr. Garson keyed up the synthetic beats of ''I'm Afraid of Americans,'' the single released this week in remixed versions by Trent Reznor of Nine Inch Nails and the fashionable techno artist Photek. The volume soared and the screen behind the stage lit up with warped images as Mr. Bowie ridiculed decadent consumerism over a tight drum-and-bass groove. Crashing from that song into 1979's grandiose ''Look Back in Anger'' and then slinking into the mock exotic ''Seven Years in Tibet,'' from ''Earthling,'' Mr. Bowie and his band pushed the evening toward a fever pitch.Though rambunctious reworkings of older songs prevailed, several highlights were newer, including ''Little Wonder,'' from ''Earthling,'' which stood up next to the innovations that once made Mr. Bowie the first electronically charged rock star. Ms. Dorsey's swooping vocals enlivened a new take on Mr. Bowie's 1982 duet with Queen, ''Under Pressure.'' And her supercharged basslines, in league with Mr. Alford's drumming, motivated ''Battle for Britain (The Letter),'' from ''Earthling,'' which also featured fractured keyboard flourishes from Mr. Garson, recalling his mood enhancements for Aladdin Sane.Yet Mr. Bowie, who is to perform and receive an award from GQ magazine as a man of the year tonight at Radio City Music Hall, is no longer the shocking groundbreaker he was in the 1970's. He is a supremely ambitious, often self-important artist saved by his love of playing the trickster -- a man who still does mime onstage, but makes sure he performs it with a sneer. Mr. Bowie's current writing partner, Mr. Gabrels, hardly matches his late collaborator Mick Ronson in intelligence or chops. Mr. Bowie, however, obviously loves this band, and he pushes them to their limit.As the two-hours-plus evening catapulted to its end, a quirky cover of Laurie Anderson's ''O Superman'' giving way to the cryogenically preserved anthem ''All the Young Dudes,'' it was easy to imagine Mr. Bowie's very organs regenerating under the force of his will to be relevant. ''Don't wanna stay alive when you're 25,'' he sang, aping the recklessness of his youth. But his catlike grin made it clear that staying alive is exactly the point when you're 50."
